{
  "company_id": "aster-demo-logistics",
  "name": "Aster Demo Logistics Ltd",
  "legal_name": "Aster Demo Logistics Ltd",
  "aliases": [],
  "identifiers": {
    "cin": null,
    "isin": null,
    "nse_symbol": "ASTERDEMO",
    "bse_code": null
  },
  "sector": "Industrials",
  "industry": "Logistics",
  "segment": "MAINBOARD",
  "lifecycle": "LISTED",
  "private_tracker": null,
  "overview": {
    "summary": "DEMO COMPANY. Fictional asset-light express logistics operator used to test the terminal.",
    "segments": [
      "Express parcel",
      "Part-truck-load",
      "Warehousing"
    ],
    "source": {
      "source_type": "SAMPLE",
      "document_id": "sample",
      "page": 112,
      "table": null,
      "section": null,
      "url": "sample://demo-document",
      "sha256": null,
      "tier": "primary"
    }
  },
  "website": null,
  "ir_url": null,
  "registered_office": null,
  "is_sample": true,
  "created_at": "2026-10-05T08:00:00+05:30",
  "updated_at": "2026-10-05T08:00:00+05:30"
}
